intervention_id,intervention_name,intervention_description,target_area,sentiment_category,roi_min_percent,roi_max_percent
1,"Hold monthly 'Autonomy Reviews' where teams flag instances where AI acted without request. Managers log patterns and adjust workflows or permissions accordingly, while reinforcing the value of user control.",This procedural approach validates user frustration with intrusive AI. It restores agency by giving teams structured ways to push back on overreach and helps leaders rebalance automation levels with human intent.,Sentiment,The Intrusive AI,6,12
2,Create a 'Too Helpful AI' meme board where employees post funny moments of AI overstepping. Use it in team retros as a light-hearted way to surface friction points and open up space for better norms of human-AI interaction.,"Playfully calling out AI overreach helps normalize annoyance without escalating tension. Humor lowers defenses, making it easier to voice discomfort and build shared awareness of when AI inserts itself too confidently.",Sentiment,The Intrusive AI,6,12
3,Run a biweekly 'Who’s in Charge?' reflection where team members log one moment they overrode AI or ignored its suggestion. Share highlights and reward thoughtful decisions that reinforce appropriate human autonomy.,"By celebrating small acts of human override, this blends self-awareness and accountability. It reframes resistance as wisdom and builds confidence that people can steer AI, not just be steered by it.",Sentiment,The Intrusive AI,6,12
4,"Launch quarterly 'Fit Check Forums' where employees document and discuss cases of AI mismatching their workflow. Managers compile themes and adjust usage guidelines, showing commitment to aligning AI with real practices.","This structured process acknowledges irritation from one-size-fits-all AI. By surfacing mismatches formally, employees feel heard, and leadership demonstrates responsiveness, reinforcing the sense that personalization matters.",Sentiment,The Unadaptive AI,6,12
5,"Host a 'Mismatch Bingo' game where staff fill bingo cards with common AI annoyances like repeating errors or forcing sameness. Prizes go to creative examples, turning irritation into shared laughter and visible learning points.","Playful exaggeration turns repeated AI misfits into collective amusement. By laughing together, teams reduce frustration and create memorable examples that managers can reference when adjusting workflows or norms.",Sentiment,The Unadaptive AI,6,12
6,Introduce a 'One Change Challenge' where each team member shares one workaround they use when AI feels rigid. Collect highlights in a shared playbook and celebrate resourceful tactics that keep human creativity in the loop.,"This reflective activity validates the ingenuity people use when AI misaligns with their habits. It reframes irritation as resourcefulness, helping teams feel empowered to adapt instead of trapped in rigid AI-driven sameness.",Sentiment,The Unadaptive AI,6,12
7,"Run 'Empathy Clinics' where employees share short cases of feeling dismissed by AI responses. Facilitators guide reflection on how acknowledgment matters, and outputs feed into etiquette norms for using AI responsibly.","This formal process validates subtle emotional discomfort. By giving structured space to surface moments of dismissal, teams highlight the importance of tone and care, reinforcing that human acknowledgment still matters.",Sentiment,The Uncaring AI,6,12
8,"Start a 'Flat Reply Hall of Fame' where staff post the most robotic or tone-deaf AI outputs they’ve seen. Add playful captions, turning frustration into humor while making lack of warmth visible in a non-threatening way.","Playfully spotlighting uncaring AI outputs reduces irritation while raising awareness. Humor makes people more willing to share dismissive examples, ensuring they are noticed without creating blame or defensiveness.",Sentiment,The Uncaring AI,6,12
9,"Introduce 'Warmth Tokens'—each week, employees award a token to a colleague who rephrased or softened an AI output in a caring way. This builds a culture of microlearning and shows that tone correction is valued behavior.","By rewarding small acts of adding empathy, this approach blends accountability and encouragement. It reframes uncaring outputs as chances for people to model warmth, making care visible and reinforcing emotional attentiveness.",Sentiment,The Uncaring AI,6,12
10,"Hold weekly ‘Decision Story Circles’ where one AI-influenced decision is retold in plain words. Peers ask what was weighed, what was ignored, and whether to act as is, add a human check, or restate the goal before moving.","By converting outputs into shared reasoning, teams replace fog with intent. The ritual normalizes brief pauses, invites questions about risk and context, and restores confidence to act only on results people can clearly defend.",Sentiment,The Confusing AI,6,12
11,"Run a monthly ‘Fog Fix Jam’ where teams rewrite one confusing AI output into a one-minute news brief. Add a funny headline, then vote on the clearest version and capture the winning plain-language template in the playbook.","Playful rewriting lowers defensiveness and makes opacity discussable. Turning perplexing findings into friendly formats builds shared language, reduces avoidance of dashboards, and gives people simple patterns to follow next time.",Sentiment,The Confusing AI,6,12
12,"Adopt ‘Explain-Back Buddies’: partners summarize each other’s AI result in sixty seconds, name one limit, and propose one next step. If either cannot explain it, they pause, seek a human view, or choose a simpler, slower route.","Peer explain-back blends candor and care. It makes uncertainty safe to surface, adds humane stop-rules, and ensures teams advance only when someone can restate the logic, the risk, and the reason the output merits action.",Sentiment,The Confusing AI,6,12
13,Set up a 'Human Interaction Roundtable' every two months where employees share when AI felt too cold. Facilitators turn insights into team guidelines that ensure balance between efficiency and authentic social connection.,"This process directly addresses discomfort with AI’s lack of warmth. By collecting experiences and shaping shared norms, it reassures people that human acknowledgment remains valued in daily workflows.",Sentiment,The Aloof AI,6,12
14,"Launch a 'Most Human Moment' contest where staff nominate the funniest or warmest AI response they’ve seen. Teams vote for winners, adding humor while highlighting when AI interactions surprisingly hit the right emotional note.","Turning AI’s rare humanlike outputs into a playful contest makes distance easier to discuss. It normalizes sharing, sparks laughter, and spotlights the qualities that people actually want more of in their interactions.",Sentiment,The Aloof AI,6,12
15,Introduce a 'One Real Connection a Day' challenge where each employee shares a brief story of replacing an AI interaction with a human one. Weekly reflections celebrate creative ways people restore warmth and social texture.,"This reflective activity reframes avoidance as positive choice. It encourages small daily habits of human connection, reminding teams that warmth and rapport are essential alongside AI’s utility.",Sentiment,The Aloof AI,6,12
16,"Form a 'Delegation Review Group' with rotating team reps who examine how AI shifts authority. They meet quarterly to log examples, clarify decision boundaries, and recommend adjustments that keep collaboration fair and transparent.","By creating a standing forum for reviewing delegation, teams gain a voice in how AI changes authority. This reduces silent role shifts, restores clarity, and helps rebuild trust across colleagues who feel differently about AI.",Sentiment,The Redefining AI,6,12
17,Host a 'Power Shift Comedy Hour' where employees stage short sketches exaggerating AI taking over team roles. The playful performances spark laughter while revealing hidden tensions around delegation and authority redistribution.,"Comedy creates a safe way to voice unease about power changes. By exaggerating scenarios, employees surface real concerns without confrontation, turning division into a shared experience that invites open discussion.",Sentiment,The Redefining AI,6,12
18,"Run a 'Decision Path Mapping' exercise where teams diagram a recent group decision, marking which steps were AI-driven, human-led, or shared. Teams reflect on whether authority felt balanced and how adjustments could improve trust.","Mapping decisions turns vague discomfort into visible patterns. It makes delegation tangible, validates concerns about imbalance, and encourages teams to actively rebalance authority between AI and human judgment.",Sentiment,The Redefining AI,6,12
19,Create a 'Flexibility Charter' led by a cross-team committee that reviews where AI processes enforce too much conformity. They publish quarterly notes that outline when teams can adjust practices and preserve creative space.,"A charter process restores flexibility by giving teams a structured way to push back on rigid patterns. It reassures people that individuality is recognized, while ensuring collaboration doesn’t get locked into uniform behaviors.",Sentiment,The Forcing AI,6,12
20,"Hold a 'Rigid Rules Roast' where teams jokingly exaggerate the most inflexible AI-driven rules. The session mixes humor with critique, encouraging teams to laugh while still surfacing examples that need reevaluation.","Roasting rigid patterns lowers tension and makes critique easier to share. By mixing humor with insight, employees highlight where conformity feels excessive without making the conversation hostile or defensive.",Sentiment,The Forcing AI,6,12
21,Run a 'Flex vs. Fix Reflection' exercise where each team identifies one process where AI rigidity helped and one where it stifled input. Groups compare patterns and agree on adjustments that balance structure with creativity.,"This reflective approach balances accountability with encouragement. It validates when rules help, but also surfaces frustration. Teams practice weighing trade-offs, making collaboration more adaptive and less stifled.",Sentiment,The Forcing AI,6,12
22,Set up a 'Collaboration Care Board' with representatives from multiple teams to collect stories where AI felt emotionally absent. The board meets quarterly to create guidelines that preserve empathy and trust in group dynamics.,"The board provides a recurring way to surface how AI’s detachment affects collaboration. By converting stories into practical norms, it reassures people that empathy will not be lost in collective work.",Sentiment,The Distant AI,6,12
23,"Run a 'Stone-Faced AI Awards' where employees submit the most wooden or detached AI responses in a team setting. Categories like 'Most Robotic Reply' add humor, while highlighting moments when coldness undermines collaboration.","Humor reduces tension while spotlighting emotionally flat outputs. By laughing at examples, teams feel safer sharing frustrations and gain clarity about the value of warmth in socially complex collaboration.",Sentiment,The Distant AI,6,12
24,Launch a 'Care Contrast Challenge' where team members describe one project outcome shaped by human empathy versus one undermined by AI’s detachment. Sharing comparisons builds awareness of empathy’s role in team success.,This reflective challenge validates unease with impassive AI by contrasting it with lived human examples. It fosters accountability to protect warmth in teamwork and strengthens collective confidence in human care.,Sentiment,The Distant AI,6,12
25,"Create a 'Transparency Forum' where team representatives meet quarterly to review how AI shaped recognition, credit, or evaluation. Notes are shared openly, giving employees a channel to question and refine decision practices.","A recurring forum ensures people can voice concerns about hidden credit or misrepresentation. By documenting and sharing outcomes, it reduces mistrust, restores visibility, and reinforces fairness in collaborative recognition.",Sentiment,The Obscuring AI,6,12
26,"Run a 'Guess Who Contributed?' game where anonymized team outputs are shown, and people try to guess who did what before AI filtered it. Laughter follows when AI blurred context, sparking awareness of hidden contributions.","Turning concealed contributions into a playful guessing game makes the issue safe to discuss. Humor lightens frustration, while showing how AI reshapes recognition and why visibility matters to collaboration.",Sentiment,The Obscuring AI,6,12
27,Launch a 'Credit Mapping Challenge' where teams trace how contributions moved from individual efforts to AI-filtered outcomes. Groups reflect on whether recognition was accurate and propose adjustments to preserve fairness.,"This reflective challenge highlights how credit shifts when AI filters inputs. It builds accountability to track recognition, validates concerns of being overlooked, and encourages teams to reassert fair acknowledgment.",Sentiment,The Obscuring AI,6,12
28,Establish a 'Connection Committee' that reviews how team interactions are being mediated by AI. They gather quarterly feedback on isolation risks and publish guidance for balancing digital efficiency with human presence.,"A committee ensures teams have a channel to surface concerns about distance created by AI. By shaping norms around balance, it reassures people that social connection remains a valued part of collaboration.",Sentiment,The Separating AI,6,12
29,"Host a 'Most Awkward Silence' contest where teams share funny moments when AI disrupted or replaced natural conversation. The stories are celebrated with light humor, opening dialogue about the importance of human flow.","Humor helps teams voice discomfort without blame. By spotlighting awkward silences, the contest reveals how AI interrupts natural flow. It reduces defensiveness and reinforces the importance of spontaneous exchanges for team trust and cohesion.",Sentiment,The Separating AI,6,12
30,"Run a 'Reconnect Challenge' where each team member commits to replacing one AI-mediated interaction with a direct human one per week. Stories are shared, highlighting small wins that rebuild natural collaboration.","This reflective challenge reframes separation as an opportunity for intentional reconnection. It validates concerns, builds accountability, and celebrates creativity in restoring warmth and trust in team dynamics.",Sentiment,The Separating AI,6,12
31,"Establish a 'Fairness Oversight Panel' with employee-elected members who review cases where AI decisions impact promotions, reviews, or access. Findings are shared quarterly, ensuring accountability and open discussion of bias risks.","An oversight panel gives employees a trusted process to question AI-driven outcomes. It reduces fear of hidden bias, reinforces transparency, and creates confidence that fairness is monitored across critical decisions.",Sentiment,The Unjust AI,6,12
32,"Host a 'Bias Bloopers Night' where staff share humorous or exaggerated examples of AI producing unfair or lopsided judgments. The event blends humor with critique, sparking dialogue on why oversight matters in high-stakes use cases.","Humor lowers defensiveness when addressing fairness issues. By laughing at flawed outputs, teams acknowledge the risks of bias together, opening the door for deeper discussions on justice and oversight.",Sentiment,The Unjust AI,6,12
33,"Introduce a 'Justice Reflection Journal' where employees note weekly moments they questioned fairness in decisions, whether human- or AI-led. Selected stories are shared in team meetings, encouraging awareness and accountability.","Reflection journals make fairness a shared responsibility. By capturing moments of discomfort, teams validate principled concerns and strengthen their collective vigilance around bias and justice in workplace decisions.",Sentiment,The Unjust AI,6,12
34,"Run monthly ‘Exception Clinics’ where people bring work the rubric can’t capture. Together they name what the template misses, agree fair exceptions, and record human guidelines leaders can apply when rigid flows squeeze unique work.","This forum validates identity and fairness concerns directly. By making nuance visible, people see they can challenge one-size-fits-all rules, surface bias, and trust that judgment won’t be flattened by uniform standards.",Sentiment,The Constricting AI,6,12
35,"Host ‘Role Narrative Showcases’—short, lively demos of work that defies the template. Present context, constraints, and values; then invite applause and feedback on how success should be recognized beyond the standard fields.","Celebrating narrative widens the sense of merit. It reveals hidden privilege in narrow categories, honors diverse ways of creating value, and prevents distinctive contributions from being boxed into misfitting profiles.",Sentiment,The Constricting AI,6,12
36,"Schedule rotating ‘Autonomy Windows’ when teams may diverge from the prescribed flow, then debrief what improved and what broke. Share insights in plain language leaders can weigh when deciding where flexibility is truly needed.","Short trials balance consistency with respect for difference. They generate fair evidence about rigidity’s harms, avoid special treatment for a few, and convert lived experience into guidance leaders can adopt without chaos.",Sentiment,The Constricting AI,6,12
37,Form an 'Ethics and Impact Council' with cross-disciplinary members tasked to review AI use in sensitive decisions. They publish impact assessments and lead quarterly sessions on compassion and responsibility in professional contexts.,"A council dedicated to ethics reassures employees that social responsibility is central to AI use. Public assessments and sessions emphasize compassion, addressing moral discomfort about AI acting without regard for fairness or harm.",Sentiment,The Callous AI,6,12
38,"Run a 'Heartless Awards' parody event where teams highlight absurd or ruthless AI choices they’ve seen. By humorously critiquing outcomes, employees engage with ethical blind spots and reinforce why empathy must guide responsible decisions.","Using parody allows staff to process discomfort collectively. By spotlighting ruthless outputs with humor, they reduce tension while reinforcing a shared expectation that empathy and human values cannot be ignored in AI decision-making.",Sentiment,The Callous AI,6,12
39,"Launch a 'Compassion Journaling Sprint' where staff note weekly reflections on how AI decisions impacted fairness or human dignity. Selected entries are shared in forums, sparking dialogue and commitments to balance efficiency with empathy.","Journaling builds reflection and accountability. By recording and sharing lived experiences of imbalance, employees validate ethical concerns and collectively commit to embedding compassion alongside productivity in professional practices.",Sentiment,The Callous AI,6,12
40,"Create a 'Reason Dossier Requirement' for high-stakes decisions: decision owners compile a plain-language rationale, human accountability sign-off, and an affected-party Q&A window. A monthly review circle samples dossiers and flags opaque cases.","Dossiers confront covertness by making reasoning traceable and accountable. Sampling reviews and sign-offs reassure people that opaque judgments can be questioned, reducing vulnerability when outcomes affect careers, resources, or recognition.",Sentiment,The Hidden AI,6,12
41,"Host a 'Mystery Box Showdown' where teams bring one baffling AI-influenced decision and race to decode it in plain words. Points for clarity, fairness framing, and naming what’s still hidden. Fun prizes, then short debriefs capture lessons.","Playful decoding builds shared skill in translating jargon and exposing vagueness. Humor lowers defensiveness so teams can name concealment without blame, turning confusion into practical cues for fairer, clearer communication across groups.",Sentiment,The Hidden AI,6,12
42,"Run a 'Right to Ask Challenge': for two weeks, employees log one respectful question they asked about an AI-affected decision and the response it prompted. Share highlights and recognize questions that improved visibility and balanced power.","Inviting respectful questions normalizes scrutiny of high-stakes decisions. Logging asks and responses turns vague unease into visible improvements, strengthening trust that employees can influence outcomes rather than endure unchallengeable verdicts.",Sentiment,The Hidden AI,6,12
43,"Adopt an 'Expertise Stewardship Accord' that lists decisions reserved for human judgment, with quarterly briefings to review substitutions and confirm boundaries. Keep a ledger tracking where human sign-off remains required.","Reserving key judgments counters fears of being replaced. Briefings turn policy into practice, letting experts challenge offloading and reassert identity and authority. The ledger signals accountability when stakes and meaning are high.",Sentiment,The Usurping AI,6,12
44,"Stage a 'Keep the Human' debate night: teams argue playful cases where AI would substitute expertise, using timed rounds and audience votes. Winners share a one-page takeaway on when presence matters, turning tension into memorable learning.","Debate adds humor without trivializing loss of identity; arguing both sides reveals trade-offs and surfaces where substitution crosses lines. Shared takeaways convert energy into guidance, making boundaries communal rather than imposed.",Sentiment,The Usurping AI,6,12
45,"Run a 'Signature Contribution Canvas' session where each person maps one decision they will remain accountable for, why it needs human presence, and a mentoring step to grow that craft. Pair up for monthly check-ins and share progress highlights.","This blends reflection, encouragement, and accountability. Naming a signature decision honors expertise; mentoring spreads craft; check-ins sustain momentum. People feel influence restored rather than extracted by faceless automation.",Sentiment,The Usurping AI,6,12
46,"Adopt a 'Job Security Compact': leaders publish a quarterly automation plan, map roles likely to shift, and convene an Employment Triad—employee rep, HR, manager—to review cases. The compact guarantees paid reskilling time before any displacement.",This compact restores agency when autonomy feels threatening. Publishing outlooks reduces rumors; the Triad brings accountability to displacement decisions; guaranteed reskilling time signals commitment to people before automation proceeds.,Sentiment,The Threatening AI,6,12
47,"Run a 'Replace Me? Prove It!' game show where teams debate a mock automation proposal. Points for naming human stakes, redesigning the workflow, and outlining safeguards. Humor keeps fear manageable while teaching how to defend roles with value.","Debating a staged proposal channels fear into learning. By arguing human stakes and workable safeguards, teams practice naming what should not be offloaded and how to redesign work, building confidence without trivializing job risk.",Sentiment,The Threatening AI,6,12
48,Launch a 'Resilience Sprint' in which each person drafts a 12-month hedge: one core strength to amplify and one adjacent skill to build. Buddy check-ins and brief showcases turn anxiety into momentum and make career bets visible and supported.,"Structured reflection plus peer support counters paralysis. Naming a strength and an adjacent bet creates a path forward, while check-ins and showcases sustain progress. People see tangible steps to stay relevant rather than awaiting replacement.",Sentiment,The Threatening AI,6,12
49,"Launch a 'Growth Assurance Board' where employees can bring cases of stalled roles caused by AI rigidity. The board reviews quarterly, ensuring career pathways remain dynamic and recommending training or redesign when stagnation emerges.","A board dedicated to growth provides structure to counter stagnation fears. By reviewing blocked roles and mandating adjustments, it reassures employees that evolving opportunities remain a priority, even alongside inflexible AI systems.",Sentiment,The Stagnating AI,6,12
50,"Host a 'Dead-End Escape Room' game where teams solve puzzles themed around breaking free of AI-imposed limits. Debriefs connect the humor back to real fears, helping participants name where rigid systems risk stalling growth.","Playful problem-solving reframes stagnation as a shared challenge. By laughing at exaggerated scenarios, teams open up about anxieties and practice thinking creatively about ways to preserve career development opportunities.",Sentiment,The Stagnating AI,6,12
51,"Introduce a 'Future Moves Challenge' where staff identify one stagnant task and design a growth alternative—new skill, rotation, or mentorship. Sharing proposals monthly builds accountability and encourages forwa",This challenge blends reflection and accountability. It validates fears of atrophy while fostering proactive steps. Employees regain agency by naming alternatives and see collective commitment to evolving career opportunities.,Sentiment,The Stagnating AI,6,12
52,"Form a 'Recognition Review Circle' where employees nominate overlooked contributions for quarterly review. The circle documents examples, recommends acknowledgment practices, and ensures recognition is restored beyond AI’s evaluations.","A review circle reassures staff that human contributions won’t vanish in data. By restoring recognition and documenting value, it counters feelings of worthlessness and reaffirms that creativity and context matter to career identity.",Sentiment,The Devaluing AI,6,12
