intervention_id,intervention_name,intervention_description,target_area,sentiment_category,roi_min_percent,roi_max_percent
53,"Hold a 'Most Undervalued Talent Show' where staff showcase quirky or hidden skills that AI would miss. Colleagues cheer, vote, and laugh together, celebrating human creativity while surfacing how AI undervalues certain contributions.","A playful showcase re-centers value on human uniqueness. By laughing at overlooked skills and cheering each other on, employees feel recognized in ways AI cannot replicate, countering disappointment and reinforcing worth.",Sentiment,The Devaluing AI,6,12
54,"Run a 'Value Journaling Pledge' where employees note one weekly moment of feeling unseen, then rewrite it as a recognition statement. Sharing some examples in groups builds reflection, accountability, and collective appreciation.","Journaling reframes invisibility into acknowledgment. By sharing rewritten recognition moments, staff validate each other, turn hurt into appreciation, and encourage teams to protect meaning where AI may strip human worth.",Sentiment,The Devaluing AI,6,12
55,"Set up a 'Career Clarity Review' where employees affected by AI evaluations can request a plain-language breakdown of the criteria used. A rotating panel ensures responses are timely, clear, and tied to growth paths rather than hidden metrics.",This review addresses inscrutability by giving employees a way to see and question how they’re being judged. Clarity reduces helplessness and turns shadowy evaluations into opportunities for growth and recalibration.,Sentiment,The Unknowable AI,6,12
56,"Run a 'Decode the Black Box' trivia game where teams guess how absurd career scenarios might be judged by opaque AI. After the laughs, facilitators link the exaggerations back to real concerns about hidden evaluation criteria.","Humor helps surface unease about obscure AI decisions. By laughing at exaggerated scenarios, employees acknowledge opacity together while learning to name the real risks of hidden logic in career evaluations.",Sentiment,The Unknowable AI,6,12
57,Introduce a 'Future Visibility Pledge' where employees draft one area where they feel in the dark about evaluation and one step they’d take if it were clarified. Monthly sharing builds accountability and promotes proactive career recalibration.,"This pledge reframes helplessness into agency. By naming unclear areas and committing to actions, employees transform opacity into reflection and accountability, regaining some control over career trajectories shadowed by AI.",Sentiment,The Unknowable AI,6,12
58,"Create a 'Human Connection Charter' that secures space for direct contact in roles affected by AI. Teams log tasks where social interaction is vital, and quarterly reviews ensure these are protected and visibly prioritized in workflows.","A charter restores agency by explicitly protecting spaces where human interaction matters. Reviews reassure employees their role essence is not being submerged, countering fears of rejection or social erosion in their work.",Sentiment,The Replacing AI,6,12
59,"Run a 'Most Human Moment Awards' where staff share stories of times personal presence or empathy shaped outcomes better than AI. Colleagues vote and celebrate, spotlighting the irreplaceable human layers that keep roles meaningful.","Celebrating human-centered moments highlights what AI cannot replicate. By cheering examples together, employees reaffirm the value of empathy and connection, countering fears of destitution and disengagement in their work.",Sentiment,The Replacing AI,6,12
60,"Launch a 'Voice Visibility Pledge' where employees commit to raising one instance per month where human input improved outcomes. Stories are logged and shared, ensuring accountability while keeping human presence visible and valued.","This pledge blends reflection with accountability. It ensures people voice their impact and reinforces collective responsibility to keep human meaning central, counteracting feelings of being submerged beneath AI-driven processes.",Sentiment,The Replacing AI,6,12
61,Form a risk governance council that meets monthly to track AI-driven decisions against stability metrics. It ensures leaders can question shifts early and reinforce shared oversight to maintain organizational direction.,"A council creates a stable rhythm for oversight, countering fears of control slipping away. By making leaders examine AI impacts regularly, it reassures employees that strategic alignment and systemic safety remain a priority.",Sentiment,The Uncontrolled AI,6,12
62,"Run a “Worst-Case Scenario Theater” where teams role-play dramatic AI mishaps. Each skit imagines exaggerated outcomes, then pauses to discuss real mitigation steps, making disruption fears discussable without overwhelming seriousness.","Humor reduces anxiety while role-play surfaces genuine concerns. By exaggerating AI failures in a safe format, people process risk imaginatively, then connect the lessons back to oversight, building both relief and awareness.",Sentiment,The Uncontrolled AI,6,12
63,Launch a “Stability Pulse” challenge where managers log one instance per month where AI decisions could have destabilized workflows. Sharing in leadership forums ensures accountab,"This challenge blends accountability with reflection, prompting leaders to engage with risks actively. By framing it as ongoing learning, it strengthens vigilance while showing teams that concerns about destabilization are openly addressed.",Sentiment,The Uncontrolled AI,6,12
64,"Create a 'Resilience Review Board' that audits AI-reliant processes twice a year. The board stress-tests workflows for fragility, identifies lock-in risks, and recommends procedural flex points to protect adaptability under changing conditions.","A review board confronts rigidity directly by auditing fragility and lock-in risks. Regular stress-tests assure staff that adaptability is being safeguarded, reducing fear that organizational stability is endangered by brittle systems.",Sentiment,The Brittle AI,6,12
65,Host a 'Rigidity Olympics' where teams compete in lighthearted games that parody inflexible rules—like following absurd procedures to complete tasks. Debriefs then connect the humor to real lessons about adaptability in workflows.,"Playful competition highlights the absurdity of rigid rules. By laughing at exaggerated inflexibility, employees process concerns about brittleness while learning why flexibility is essential for resilience and organizational health.",Sentiment,The Brittle AI,6,12
66,Run a 'Flexibility Ledger' challenge where managers log one instance each month where adaptability improved outcomes. Sharing examples in leadership forums builds accountability and encourages systemic reflection on resilience practices.,"This challenge blends reflection with accountability. By documenting adaptability wins, leaders validate resilience as a priority, countering fears of uniformity and rigidity while modeling how to protect organizational stability.",Sentiment,The Brittle AI,6,12
67,"Institute a 'Human Values Gate' for major AI rollouts: facilitated sessions examine meaning, connection, and care impacts before launch. Produce a one-page cultural impact note and assign a named owner to uphold commitments in operations.","A pre-launch gate slows drift toward mechanization and sterility. Translating concerns into a short, accountable note makes trade-offs visible and ensures leaders protect human tone, not just efficiency, across the system.",Sentiment,The Dehumanizing AI,6,12
68,Hold a 'No-Algorithm Coffee Lottery' pairing strangers monthly for short chats about customer moments that needed warmth. Collect three-sentence stories; a light showcase celebrates connection and keeps human texture vivid across teams.,"Playful pairing rebuilds social glue threatened by automation. Sharing brief stories spotlights where care beats efficiency, reminding the organization that meaning travels through people and relationships, not just optimized flows and metrics.",Sentiment,The Dehumanizing AI,6,12
69,"Start a 'Care Shadowing Exchange' where leaders spend two hours monthly observing frontline interactions, then share one safeguard they will champion to preserve humanity. Peers follow up next month, turning reflection into sustained action.","Shadowing grounds philosophy in lived work. Naming a safeguard and reporting back blends encouragement and accountability, signaling that culture and dignity are strategic assets, not optional extras, even as AI scales across operations.",Sentiment,The Dehumanizing AI,6,12
70,"Establish a 'Decision Defense Hearing' for high-impact AI uses: owners narrate the decision trail, state assumptions, and name an accountable signer. A monthly docket samples cases under tough questioning; shared minutes expose risks and liabilities.","Hearings counter opacity by requiring clear narratives and accountable signatures. Regular sampling under pressure exposes hidden assumptions, making risks visible and defensible, stabilizing strategy when scrutiny by boards or regulators arrives.",Sentiment,The Risky AI,6,12
71,"Run 'Explain It or Spin It?' mock press briefings: teams field curveball questions about a past AI-shaped decision in plain language. The audience rings a bell for jargon, then a brief debrief captures phrases that made risk and accountability clear.","Playful press briefings reduce fear while building the muscle of explanation. Calling out jargon with a bell turns opacity into a learning moment and creates memorable wording leaders can use when defending decisions to customers, auditors, or media.",Sentiment,The Risky AI,6,12
72,"Launch a 'One Risk, One Remedy' ritual: each senior leader selects a recent AI-touched decision, writes a customer-ready paragraph explaining it, and commits one governance habit to add. Peers revisit next month to confirm the remedy was practiced.","This blend of reflection and accountability turns vague unease into steady improvement. Writing for a customer encourages clarity; naming a habit creates ownership; peer follow-ups ensure changes stick, strengthening trust when decisions are challenged.",Sentiment,The Risky AI,6,12
73,"Form a “Culture and Cohesion Forum” where representatives from different teams meet monthly to assess how AI adoption affects trust, morale, and human connection, issuing recommendations for preserving relational practices.","This action anchors accountability in ongoing dialogue, ensuring AI’s impact on collaboration and cohesion is regularly reviewed. It reassures employees that trust and cultural integrity remain priorities, even as automation expands.",Sentiment,The Undermining AI,6,12
74,"Launch “Connection Quests” where teams earn playful recognition by planning informal gatherings, coffee chats, or shared rituals that strengthen human bonds alongside AI use. Light competition ensures AI doesn’t overshadow relational practices.","By gamifying relational care, this action restores balance to workplaces where AI risks replacing spontaneous human connection. It highlights the fun and importance of everyday interactions, mitigating alienation or surrender to sterile systems.",Sentiment,The Undermining AI,6,12
75,"Introduce a reflective practice where managers host quarterly “Human Value Sessions,” inviting staff to share moments when AI disrupted or strengthened trust. Lessons are documented and turned into nudges reinforcing human-centered collaboration.","This action blends accountability with encouragement, showing that emotional and cultural impacts of AI are as valid as efficiency metrics. It empowers employees to name risks, reframe practices, and safeguard the social glue that keeps teams resilient.",Sentiment,The Undermining AI,6,12
